,rank,songname,artist,urls,lyrics_raw
21,,,,,"[Produced by Boi-1da & Vinylz] / [Intro: Drake & Big Sean] / Look / I feel blessed / Way up, I feel blessed / Way up, I feel blessed / (Straight... look) / [Verse 1: Big Sean] / I live the life I deserve, blessed / Fuck a vacay I feel better at work / I mean whatever it's worth, I give whatever I'm worth / For my niggas who gon' go to Hell and back for me / I'mma give 'em Heaven on Earth / Or a hell of a check, yeah, whichever come first / Blessings on blessings on blessings / Look at my life, man, that's lessons on lessons on lessons / I treat the beat like it's a reverend / I tell the truth like father, forgive me, these are all my confessions / Man, this wasn't luck, it was destined / I done lost homies who been with me since / Ed, Edd n Eddy / Who flip like confetti / And then when you back, they back to call you ""dog"" / That shit get-get petty, bitch, don't give no dap to me, nigga / Funny thing about talking behind my back / Is that it just keep coming back to me, nigga / Was off for a sec, now it's back to me, nigga, you mad at me / This ain't what I want, man, this what it had to be / This is that late night working after three, man / This is why my old girl was mad at me / This why I'm your majesty, man / The clique is the tightest, the pussy the tightest / The drinks are the coldest, the future the brightest / The feat not divided, the love is divided / And I just gotta thank God that we got it / Blessed / I don't know what I would do without it / Crew look like we robbed a bank, but all we make is deposits / Your prophet will profit, oh God / [Hook: Drake (Big Sean)] / I'm here for a good time, not a long time, you know I / I haven't had a good time in a long time, you know I / I'm way up, I feel blessed / Way up, I feel blessed (Straight up) / I'm way up, I feel blessed (Straight up, straight up) / Way up, I feel blessed / [Verse 2: Drake] / Look, I ain't gon' say that we back or nothing / ‘Cause that implies that we're back from something / If we're back from somethin' there's some checks you owe us / I expect that payment, nothing less or over / I don't need them favors that you ask me for / I could give two fucks 'bout where the Grammys go / I just gave out Grammys on my Instagram / Them OVO boys, the business man / It is what it is, trust me, you get what you give, yeah / You gotta come to my side and see how we live, yeah / I cannot see Heaven being much better than this, yeah / Blessings on blessings for me and my niggas from the 6 / Look at what we did, yeah / Be quiet, I'm doing a toast / For niggas that don't really do shit, I swear, y'all be doing the most / Stop worrying 'bout whoever's next / I am just worried 'bout my mama worrying less / I think I'm famous enough, I don't need any more press / I am convinced I'm the only one left / That's still doing this shit, man / [Hook: Drake (Big Sean)] / I'm here for a good time, not a long time, you know I / I haven't had a good time in a long time, you know I / I'm way up, I feel blessed / Way up, I feel blessed (Straight up) / I'm way up, I feel blessed (Straight up, straight up) / Way up, I feel blessed / [Verse 3: Big Sean] / My grandma just died, I'm the man of the house / So every morning I'm up ‘cause I can't let them down, down / Always down for the cause, never down for the count / I guess when your stars align / You do like the solar system and plan it out / So I'm going over time, on the overtime / Yeah, I'm that invested, but you can't attest it / Million dollar goals, managed to manifest it / The family never going anorexic / I pay mom mortgage and electric / Never going under even with anesthetics / At the top of the rap game and progressin' / Check after check, checking off my check list / Try and blow my cake, just know that's a death wish / No mistakes in life ever, it's only lessons / Shit feel like Shaq and Penny got back together / You tore the game apart, who put it back together? I / [Hook: Drake (Big Sean)] / I'm here for a good time, not a long time, you know I / I haven't had a good time in a long time, you know I / I'm way up, I feel blessed / Way up, I feel blessed (Straight up) / I'm way up, I feel blessed (Straight up, straight up) / I'm way up, I feel blessed / [Verse 4: Kanye West] / Since the truth keep niggas traumatized / They tryna compromise my condom size / So I Snapchat that whole shit / Tryna see titties, tryna show dick / And I swear to God I hope they post it / I'm blessed / Even though I get slammed with lawsuits like car doors / See three P.O.'s like Star Wars / They want me by the road holding up cardboard / So I go extra hard on the hard floor / Right now, I'm calling you from my home gym / Right after that, nigga, I'm gon' swim / Just did a couple laps in my home pool / And my daughter right there getting home-schooled / I'm blessed / And I was thinking 'bout starting up my own school / A Montessori / And the hallway looking like a monastery, oh yes / I'm way up, I feel blessed"
22,,,,,"[Verse 1 - George Ezra] / My house in Budapest, my / My hidden treasure chest / Golden grand piano / My beautiful Castillo / [Bridge - George Ezra] / You / You / I'd leave it all / [Verse 2 - George Ezra] / My acres of a land / I have achieved / It may be hard for you to / Stop and believe / [Bridge - George Ezra] / But for you / You / I'd leave it all / [Bridge - George Ezra] / Oh, for you / You / I'd leave it all / [Chorus - George Ezra] / Give me one good reason / Why I should never make a change / And baby if you hold me / Then all of this will go away / [Verse 3 - George Ezra] / My many artifacts / The list goes on / If you just say the words, I / I'll up and run / [Bridge - George Ezra] / Oh, to you / You / I'd leave it all / [Bridge - George Ezra] / Oh, to you / You / I'd leave it all / [Chorus - George Ezra] / Give me one good reason / Why I should never make a change / And baby if you hold me / Then all of this will go away / [Chorus - George Ezra] / Give me one good reason / Why I should never make a change / And baby if you hold me / Then all of this will go away / [Verse 4 - George Ezra] / My friends and family / They, dont understand / They fear they'd lose so much / If you took my hand / [Bridge 2 - George Ezra] / But for you / You / I'd lose it all / [Bridge 2 - George Ezra] / But for you / You / I'd lose it all / [Chorus - George Ezra] / Give me one good reason / Why I should never make a change / And baby if you hold me / Then all of this will go away / [Chorus - George Ezra] / Give me one good reason / Why I should never make a change / And baby if you hold me / Then all of this will go away / [Verse 5 - George Ezra] / My house in Budapest, my / My hidden treasure chest / Golden grand piano / My beautiful Castillo / [Bridge - George Ezra] / You / You / I'd leave it all / [Bridge - George Ezra] / You / You / I'd leave it all"
23,,,,,"[Produced by / Greg Kurstin / and / Jesse Shatkin / ] / [Written by Sia and Jesse Shatkin] / [Video performed by Maddie Ziegler and choreographed by Ryan Heffington] / [Verse 1] / Party girls don't get hurt / Can’t feel anything, when will I learn / I push it down, push it down / I'm the one ""for a good time call"" / Phone’s blowin' up, ringin' my doorbell / I feel the love, feel the love / [Pre-Chorus] / 1 2 3, 1 2 3, drink / 1 2 3, 1 2 3, drink / 1 2 3, 1 2 3, drink / Throw 'em back till I lose count / [Chorus] / I'm gonna swing from the chandelier / From the chandelier / I'm gonna live like tomorrow doesn't exist / Like it doesn't exist / I'm gonna fly like a bird through the night / Feel my tears as they dry / I'm gonna swing from the chandelier / From the chandelier / [Post-Chorus] / But I'm holding on for dear life / Won't look down, won't open my eyes / Keep my glass full until morning light / Cause I'm just holding on for tonight / Help me, I'm holding on for dear life / Won't look down, won't open my eyes / Keep my glass full until morning light / Cause I'm just holding on for tonight / On for tonight / [Verse 2] / Sun is up, I'm a mess / Gotta get out now, gotta run from this / Here comes the shame, here comes the shame / [Pre-Chorus] / 1 2 3, 1 2 3, drink / 1 2 3, 1 2 3, drink / 1 2 3, 1 2 3, drink / Throw 'em back till I lose count / [Chorus] / I'm gonna swing from the chandelier / From the chandelier / I'm gonna live like tomorrow doesn't exist / Like it doesn't exist / I'm gonna fly like a bird through the night / Feel my tears as they dry / I'm gonna swing from the chandelier / From the chandelier / [Post-Chorus] / But I'm holding on for dear life / Won't look down, won't open my eyes / Keep my glass full until morning light / Cause I'm just holding on for tonight / Help me, I'm holding on for dear life / Won't look down, won't open my eyes / Keep my glass full until morning light / Cause I'm just holding on for tonight / On for tonight / [Outro] / On for tonight / Yeah I'm just holding on for tonight / Oh, I'm just holding on for tonight / On for tonight, on for tonight / Yeah I'm just holding on for tonight / I'm just holding on for tonight / Oh, I'm just holding on for tonight / On for tonight, on for tonight"
24,,,,,"[Intro] / This is my heartbeat song and I'm gonna play it / Been so long I forgot how to turn it / Up, up, up, up all night long / Oh, up, up all night long / [Verse 1] / You, where the hell did you come from? / You're a different, different kind of fun / And I'm so used to feeling numb / Now I got pins and needles on my tongue / Anticipating what's to come / Like a finger on a loaded gun / [Pre-Chorus 1] / I can feel it rising / Temperature inside me / Haven't felt it for a long time / [Chorus] / This is my heartbeat song and I'm gonna play it / Been so long I forgot how to turn it / Up, up, up, up all night long / Oh, up, up all night long / This is my heartbeat song and I'm gonna play it / Turned it on, but I know you can take it / Up, up, up, up all night long / Oh, up, up all night long, all night long / [Verse 2] / I, I wasn't even gonna go out / But I never would have had a doubt / If I'd have known where I I'd be now / [Pre-Chorus 2] / Your hands on my hips / And my kiss on your lips / Oh, I could do this for a long time / [Chorus] / This is my heartbeat song and I'm gonna play it / Been so long I forgot how to turn it / Up, up, up, up all night long / Oh, up, up all night long / This is my heartbeat song and I'm gonna play it / Turned it on, but I know you can take it / Up, up, up, up all night long / Oh, up, up all night long, all night long / [Bridge] / Until tonight I only dreamed about you / I can't believe I've ever breathed without you / Baby, you make me feel alive and brand new / Bring it one more time, one more time / [Chorus] / This is my heartbeat song and I'm gonna play it / Been so long I forgot how to turn it / Up, up, up, up all night long / Oh, up, up all night long / This is my heartbeat song and I'm gonna play it / Turned it on, but I know you can take it / Up, up, up, up all night long / Oh, up, up all night long, all night long / This is my heartbeat song and I'm gonna play it / Been so long I forgot how to turn it / Up, up, up, up all night long / Oh, up, up all night long / This is my heartbeat song and I'm gonna play it / Turned it on, but I know you can take it / Up, up, up, up all night long / Oh, up, up all night long, all night long"
25,,,,,"[Verse 1] / I met this girl late last year / She said ""don't you worry if I disappear"" / I told her I'm not really looking for another mistake / I called an old friend thinking that the trouble would wait / But then I jumped right in a week later, returned / I reckon she was only looking for a lover to burn / But I gave her my time for two or three nights / Then I put it on pause until the moment was right / I went away for months until our paths crossed again / She told me / ""I was never looking for a friend / Maybe you could swing by my room around ten / Baby, bring the lemon and a bottle of gin / We'll be in between the sheets till the late AM"" / Baby, if you wanted me then should have just said / , / she's singing / [Hook] / Don't fuck with my love / That heart is so cold / All over my home / I don't wanna know that babe / Don't fuck with my love / I told her she knows / Take aim and reload / I don't wanna know that babe / [Verse 2] / And for a couple weeks I only wanna see her / We drink away the days with a takeaway pizza / Before a text message was the only way to reach her / Now she's staying at my place and loves the way I treat her / Singing out Aretha, all over the track like a feature / And never wants to sleep, I guess that I don't want to either / But me and her, we make money the same way / Four cities, two planes, the same day / And those shows have never been what it's about / But maybe we'll go together and just figure it out / I'd rather put on a film with you and sit on a couch / But we should get on a plane or we'll be missing it now / Wish I'd have written it down, the way that things played out / When she was kissing him, how I was confused about / Now she should figure it out, while I'm sat here singing / [Hook] / Don't fuck with my love / That heart is so cold / All over my home / I don't wanna know that babe / Don't fuck with my love / I told her she knows / Take aim and reload / I don't wanna know that babe / [Verse 3] / (Knock knock knock) on my hotel door / I don't even know if she knows what for / She was crying on my shoulder, I already told ya / Trust and respect is what we do this for / I never intended to be next / But you didn't need to take him to bed, that's all / And I never saw him as a threat / Until you disappeared with him to have sex, of course / It's not like we were both on tour / We were staying on the same fucking hotel floor / And I wasn't looking for a promise or commitment / But it was never just fun, and I thought you were different / This is not the way you realised what you wanted / It's a bit too much, too late if I'm honest / And all this time, God knows I'm singing / [Hook] / Don't fuck with my love / That heart is so cold / All over my home / I don't wanna know that babe / Don't fuck with my love / I told her she knows / Take aim and reload / I don't wanna know that babe / Don't fuck with my love / That heart is so cold / All over my home / I don't wanna know that babe / Don't fuck with my love / I told her she knows / Take aim and reload / I don't wanna know that babe"
26,,,,,"[Chorus] / I keep going to the river to pray / Cause I need something that can wash out the pain / And at most, I'm sleeping all these demons away / But your ghost, the ghost of you / It keeps me awake / [Verse 1] / My friends had you figured out / Yeah they saw what's inside of you / You tried hiding another you / But your evil was coming through / These eyes sitting on the wall / They watch every move I make / Bright light living in the shade / Your cold heart makes my spirit shake / [Pre-Chorus] / I had to go through hell to prove I'm not insane / Had to meet the devil just to know his name / And that's when my love was burning / Yeah it's still burning / [Chorus] / I keep going to the river to pray / Cause I need something that can wash out the pain / And at most, I'm sleeping all these demons away / But your ghost, the ghost of you / It keeps me awake / I keep going to the river to pray / Cause I need something that can wash out the pain / And at most, I'm sleeping all these demons away / But your ghost, the ghost of you / It keeps me awake / [Verse 2] / Each time that I think you go / I turn around and you're creeping in / And I let you under my skin / Cause I love living innocent / Oh, you never told me / True love was gonna hurt / True pain I don't deserve / Truth is that I never learned / [Chorus] / I keep going to the river to pray / Cause I need something that can wash out the pain / And at most, I'm sleeping all these demons away / But your ghost, the ghost of you / It keeps me awake / I keep going to the river to pray / Cause I need something that can wash out the pain / And at most, I'm sleeping all these demons away / But your ghost, the ghost of you / It keeps me awake / [Bridge] / Give up the ghost, give up the ghost / Give up the ghost, stop the haunting baby / Give up the ghost, give up the ghost / Give up the ghost, no more haunting baby / I keep going to the river... / [Chorus] / I keep going to the river to pray / Cause I need something that can wash out the pain / And at most, I'm sleeping all these demons away / But your ghost, the ghost of you / It keeps me awake / I keep going to the river to pray / Cause I need something that can wash out the pain / And at most, I'm sleeping all these demons away / But your ghost, the ghost of you / It keeps me awake"
27,,,,,"[Written by Alessia Cara & Sebastian Kole] / [Produced by Pop & Oak and Sebastian Kole] / [Intro] / I guess right now you've got the last laugh / [Verse 1] / I'm sorry if I seem uninterested / Or I'm not listenin', or I'm indifferent / Truly I ain't got no business here / But since my friends are here, I just came to kick it / But really I would rather be at home all by myself / Not in this room / With people who don't even care about my well-being / I don't dance, don't ask, I don't need a boyfriend / So you can, go back, please enjoy your party / I'll be here / Somewhere in the corner / Under clouds of marijuana / With this boy who's hollering / I can hardly hear / Over this music I don't listen to / And I don't wanna get with you / So tell my friends that I'll be over here / [Chorus] / Oh-oh-oh here, oh-oh-oh here / Oh I ask myself, what am I doin' here? / Oh-oh-oh here, oh-oh-oh here / And I can't wait 'til we can break up out of here / [Verse 2] / Excuse me if I seem a little unimpressed with this / An anti-social pessimist, but usually I don't mess with this / And I know you mean only the best / And your intentions aren't to bother me / But honestly I'd rather be / Somewhere with my people / We can kick it and just listen to / Some music with a message, like we usually do / And we'll discuss our big dreams / How we plan to take over the planet / So pardon my manners / I hope you'll understand that I'll be here / Not there in the kitchen / With the girl who's always gossiping about her friends / So tell them I'll be here / Right next to the boy who's throwin' up / Cause he can't take what's in his cup no more / Oh God why am I here? / [Chorus] / Oh-oh-oh here, oh-oh-oh here / Oh I ask myself, what am I doin' here? / Oh-oh-oh here, oh-oh-oh here / And I can't wait 'til we can break up out of here / [Bridge] / Hours later congregatin' next to the refrigerator / Some girl talkin' 'bout her haters, she ain't got none / How did it ever come to this? I shoulda never come to this / So holla at me, I'll be in the car when you're done / I'm stand-offish, don't want what you're offerin' / And I'm done talkin', awfully sad it had to be that way / So tell my people when they're ready that I'm ready / And I'm standin' by the TV with my beanie low / Yo I'll be over here / [Chorus] / Oh-oh-oh here, oh-oh-oh here / Oh I ask myself, what am I doin' here? / Oh-oh-oh here, oh-oh-oh here / And I can't wait 'til we can break up out of here"
28,,,,,"[Verse] / My face above the water / My feet can't touch the ground / Touch the ground, and it feels like / I can see the sands on the horizon / Everytime you are not around / [Hook] / I'm slowly drifting away (drifting away) / Wave after wave, wave after wave / I'm slowly drifting (drifting away) / And it feels like I'm drowning / Pulling against the stream / Pulling against the stream / [Verse] / I wish I could make it easy / Easy to love me, love me / But still I reach, to find a way / I'm stuck here in between / I'm looking for the right words to say / [Hook] / I'm slowly drifting, drifting away / Wave after wave, wave after wave / I'm slowly drifting (drifting away) / And it feels like I'm drowning / Pulling against the stream / Pulling against the stream"
29,,,,,"[Nicky Jam] / Dime si es verdad... / Me dijeron que te estas casando / Tú no sabes lo que estoy sufriendo / Esto te lo tengo que decir / Cuéntame / Tu despedida para mi fue dura / Será que te llevo a la luna / Y yo no supe hacerlo así / Te estaba buscando / Por las calles gritando / Eso me está matando oh no / Te estaba buscando / Por las calles gritando / Como un loco tomando oh... / Es que yo sin ti / Y tú sin mi / Dime quién puede ser feliz / Esto no me gusta / Esto no me gusta / Es que yo sin ti / Y tú sin mi / Dime quién puede ser feliz / Eso no me gusta / Eso no me gusta / Vivir si ti, no aguanto más / Por eso vengo a decirte lo que siento / Estoy sufriendo en esta soledad / Y aunque tu padre no aprobó esta relación / Yo sigo insistiendo a pedir perdón / Lo único que importa está en tu corazón / Te estaba buscando / Por las calles gritando / Esto me está matando oh no / Te estaba buscando / Por las calles gritando / Como un loco tomando oh... / Es que yo sin ti / Y tú sin mi / Dime quién puede ser feliz / Esto no me gusta / Esto no me gusta / Es que yo sin ti / Y tú sin mi / Dime quién puede ser feliz / Eso no me gusta / Eso no me gusta / Yo te juré a ti eterno amor / Y ahora otro te da calor / Cuando en las noches tienes frío oh oh / Yo sé que él te parece mejor / Pero yo estoy en tu corazón / Y por eso pido perdón / Es que yo sin ti / Y tú sin mi / Dime quién puede ser feliz / Esto no me gusta oh no / Es que yo sin ti / Y tú sin mi / Dime quién puede ser feliz / Esto no me gusta oh yeah... / (Tú sin mí) / Dicen que uno no sabe lo que tiene / Hasta que lo pierde pero... / (Yo sin ti) / Vale la pena luchar por lo que uno quiere / (No puedo vivir así) / Y hacer el intento / (No quiero vivir así) / N.I.C.K / Nicky Nicky Nick Jam / (No quiero que me dejes por favor) / Saga White Black / (Y te pido perdón) / La Industria Inc"
30,,,,,"[Intro: Juicy J] / Yeah, uh-huh! / Your boy Juicy J / She bad, yeah / [Verse 1: Juicy J] / In case you didn't know, Juicy that nigga / I keep me two hoes like that nigga Jack Tripper / I shoot in they face like that boy Reggie Miller / And I kill that pussy like my name Jack the Ripper / Baby, I'm horny and I ain't too proud to beg / Instead show me the bed / Early morning breakfast and head / And I got Tina, Tasha and Toya, I call ‘em the triple threat / All them bitches be soaking wet / This the first night them bitches met / [Verse 2: Ne-Yo] / You know from the moment she turn around / She know how to back it up and drop it down / She know she what all the fellas looking at / Cause they know soon as her song come on it's a wrap / [Pre-Chorus 1: Ne-Yo] / And she loves the attention / That she get when she moves, yeah / Showin' out with her home girls / Hypnotizing all the dudes, oh / [Chorus: Ne-Yo] / And she knows / (She knows, she knows, she knows) / She knows / (She knows, she knows, she knows) / She knows / (She knows, she knows, she knows) / I know, I know, she knows / (She knows, she knows, she knows) / And I know, I know, she knows / [Verse 3: Ne-Yo] / She bad, mix of ratchet with the classy, oh / So bad, I just couldn't let her pass me, no / I told her, ""Shawty, you so right, but you so wrong"" / (So wrong, so wrong, so wrong) / She said, ""Daddy, I'll be back after this song"" / ""Then you takin' me home"" / Said I know / [Pre-Chorus 2: Ne-Yo] / Said I know she loves the attention / That she get when she moves / Showin' out with her home girls / And she got me watching too, girl / [Chorus: Ne-Yo] / And she knows / (She knows, she knows, she knows) / She knows / (She knows, she knows, she knows) / She knows / (She knows, she knows, she knows) / I know, I know, she knows / (She knows, she knows, she knows) / And I know, I know, she knows / [Verse 4: Juicy J] / She know what she working with / (She know, she know, she know) / I see you, uh / You got my attention, baby, go do what you do / Eviction notice, know you gon' have to make a move / All this ice in my Rollie, no wonder I play it cool / Ain't no I in team, but I got my eyes on you / I watch it bounce when she walk / She lick her lips when she talk / I throw her in that Bentley coupé with the top off like Mardi Gras / All that cake, come get you some filling / Like a soap opera, watch all my children / Hit it so long that she might lose feeling / With her legs in the air, she gon' walk on the ceiling / [Pre-Chorus 2: Ne-Yo] / Said I know she loves the attention / That she get when she moves / Showin' out with her home girls / And she got me watching too, girl / [Chorus: Ne-Yo] / And she knows / (She knows, she knows, she knows) / She knows / (She knows, she knows, she knows) / She knows / (She knows, she knows, she knows) / I know, I know, she knows / (She knows, she knows, she knows) / And I know, I know, she knows"
